,content_spaced
0,현대제철 합격 자기소개서 샘플 직무 모집 분야 공통 . 본인 성격의 장단점을 자신의 성장 과정과 경험을 기반으로 서술하여 주십시오 . 자 자 요즘 시대에 흔치 않은 남매로 자라왔고 고등학생 때부터 기숙사 생활을 하면서 조직 생활에 어울리는 친화력과 희생 정신을 키워왔습니다 . 앞으로 회사 생활을 할 때 저만의 이익을 추구하기보다 회사를 위해 판단하고 행동할 수  있다는 점은 저의 장점입니다 . 저는 다양한 조직의 구성원으로 생활해왔으며 대를 위하여 소를 희생한다는 개념을 이해하고 있고 개인의 편의나 욕심보다 조직의 이익을 위한 결정을 내리고 수행하는 일에 익숙합니다 .이러한 저의 성향을 보여줄 수 있는 사례는 중 가장 기억에 남는 것은 대학 재학 중 생산직 아르바이트로 근무하면서 팀을 성공적으로 이 끌었던 것입 니다 . 저희 팀은 대 초중반으로 이루어져 있었고 아르바이트 특성상 금방 그만두는 사람이 많았습니다 . 교대 근무 중 갑자기 결원이 생기면 일 정 조정이 불가피했는데 이 때 근무하겠다는 사람이 없을 때마다 제가 나서서 근무를 자청했습니다 . 그러한 일이 몇 번 있고 나서는 저를 통해서 근무 일정을 조정하는 것이 자리 잡았습니다 . 저는 오전 오후 근무자를  아우르며 교대 근무 일정을 효율적으로 조정하였고 갑작스러운 결원이 생겼을 때에도 빠르게 대처하였습니다 . . 현대자동차그룹 핵심가치 고객 최우선 도전적 실행 소통과 협력 인 재존중 글로벌 지향 중 본인의 경험을 기반으로 실천 사례를 제시하시오 . 자 자 전공 실습을 수행하며 소통과 협력의 가치를 실천 한 경험이 있습니다 . 전공 중 인 조로 실습을 수행하는  작업이 있었습니다 . 그런데 회로 구성 후 작동 단계에서 실린더가 제대로 작동하지 않는 문제가 발생했습니다 . 그 이유에 대해서 저희 조원들은 각자 의견을 내 세웠지만 결국 정확한 원인을 찾지 못하였고 교수님의 검수 결과 저의 의견이 틀린 것으로 판명 되었습니다 . 낮은 점수를 받은 것이 저의 탓이라는 생각에 저는 조원들과 어색해졌습니다 . 그런데 그 과목 에서 계속 조별 실습을 해야 했기에 조원들과 관계를 회복해야 했습니다 . 저는 오랜 고민 끝에 솔직한 사과와 소통 그리고 협력을 약속하는 것이 최선이라는 생각이 들었습니다 .다음 실습이 시작되기 전에 저는 조원들과 함께 이야기를 나눌 시간을 가졌습니다 . 지난번 실습에서 저의 잘못을 솔직하게 인정하고 낮은 점수를 받은 것에 대해 사과하였으며 다음부터는  철저하게 준비하고 나와 다른 의견을 적극 수용하겠다는 의사를 전달하였고 조원들은 저의 진심을 믿어주었습니다 . 이후 진행된 실습에서 저희는 소통과 협력을 통해 좋은 실험 결과를 이끌어낼 수 있었고 높은 점수를 받음으로써 첫 실습의 실패를 만회할 수 있었습니다 . . 본인이 회사를 선택함에 있어 중요시 여기는 가치와 현대제철이 왜 그 가치와 부합하는지 본 인의 의견을 서술하여 주십시오 . 자 자 저는 기업의 과거 발자취와 현재의 위상도 중요하지만 미래를 대하는 자세를 가장 중요하게 생각합니다 . 현대제철은 더욱 가볍고 안전한 자동차를 만들기 위한 등 공법을 적용한 자동차 부품 소재 개발에 힘쓰고 있습니다 . 또한 연비 절감을 위한 노력과 배기가스를 줄여 궁극적으로 지구 온난화를 해결하고자 하는 의지를 보 이 고 있습니다 . 이 과정에서 기술 개발과 인재 양성에 집중하여 장기적으로 발전 가능성을 확장하는 행 보 역시 눈에 띄었습니다 .그동안 국내뿐만 아니라 세계 시장에서 인정받은 뛰어난 기술력을 바탕으로 과 거부터 현재까지 발전을 거듭해왔고 나아가서 미래를 위해 노력하는 현대제철의 모습에 깊은 감명을 받아 지원하게 되었습니다 . 현재의 위상에 만족하지 않고 미 래 인류의 안전과 행복 지구 환경을 보전하는 일에 힘쓰는 기업에서 일하게 된다면 비록 생산 단계 일부를 맡고 있을 뿐 일지라도 내가 하는 일이 세계에 보탬이 된다는 자긍심을 가지고 높은 직무 만족도를 느낄 수 있을 것으로 생각했기 때문입니다 . . 해당 직무에 지원한 동기와 해당 직무에 본인이 적합한 이 유 및 근거를 본인의 경험 전공 등과 연계하여 서술하 여 주십시오 . 자 자 공정 기술 분야의 발전은 제품을 생산할 때 투입 인력 시간 원자재가 같더라도 더욱 효율적인 생산이 가능하게 할 수 있습니다 . 따라서 공정 기술 분야는 설비 개선과 운영을 통해 이러한 부분을 고민하고 개선하여 생산량을 조절할 수 있는 분야입니다 . 저는 생산품 자체에 관한 연구도 중요하지만 그것을 만들어내는 과정을 연구하여 발전을  위해 고민하고 노력합니다 . 전공 프로젝트를 수행하거나 아르바이트 인턴으로 생산직에 종사하면서 맡은 일이 크지 않더라도 조금이라도 더 나은 생산력과 품질을 위해 어떤 행동을 해야 할지 근본적으로 고민해왔습니다 . 그러한 노력으로 졸업 프로젝트에서 생산성 향상을 위한 모듈을 완성하여 높은 점수를 받았고 년 대학생 산학 실습 중 생산 라인에 투입되었을 때 에도 조금이라도 더 효율적으로 일하기 위해 일찍 출근하여 근무 준비를 마치고 업무에 임하면서 잔업을 . 그 결과 우수 학생으로 선정되어 업체에서 지원하는 장학금을 받기도 했습니다 . 이렇게 공정 기술 분야의 발전을 위해 고민하고 실천하는 자세를 유지하여 앞으로 실무를 수행하면서도 최적의 효율과 설비 개선을 위해 노력하겠습니다 .
1,국민연금공단 합격 자기소개서 샘플 직무 모집 분야 공통 . 공단의 인재상 창의인 전문인 소통인 중 한 가지를 골라 이와 연관된 경험 활동 노력 등을 지원자가 공단의 인재상에 부합된다는 근거를 구체적으로 기술하여 주시기 바랍니다 . 자 저는 끊임없이 발전을 위해 노력하는 전문인이라고 생각합니다 . 저는 항상 제가 속한 집단이나 조직에서 최고가 되고 싶어 하는 성 향을 가지고 있습니다 . 이러한 성향 덕에 저는 다양한 분야에서 노력하고 성과를 거두어 왔고 지금도 계속해서 성과를 내기 위해 노력하고 있습니다 . 그 한 예로 저는 대학교 입학 이후 제가 관심이 있는 두 가지 활동에서 성과를 거두었습니다 . 한 가지는 러닝입니다 . 흔히 러닝은 다이어트나 체력 증진 목적의 단순한 운동으로 인식됩니다 . 그래서 취미로 달리기 를 하는 사람은 많지만 이를 통해 어떤 성취를 이루거나 목표를 달성하고자 하는 사람은 많지 않습니다 . 저도 처음에는 단순히 달리는 것이 좋아 러닝을 시작했습니다 . 그러나 점점 기록에 대한 욕심이 생겼습니다 . 이에 저는 체계적으로 기록 향상에 대한 계획을 세우고 기록을 지속해서 체크하며 조금 더 좋은 성과를 내기 위해 계속 연습을 했습니다 . 러닝크 루에 가입하여 함께 목표를 위해 노력할 사람들을 만나기도 했습니다 . 그 결과 기록이 점점 향상 되었고 마침내 모 브랜드에서 개최한 도시 마라톤 대회에서 우승하게 되었습니다 . 운동선수 출신이 아닌 사람으로서는 이례적인 일이었습니다 . 또 한 가지 활동은 사업 계획입니다 . 저는 대학교 때 교내 컨설팅 학회에서 활동했습니다 . 컨설팅에 대해 학습하는 이 학회 에는 마케팅 영업 인수합병 사업기획 등 다양한 분야가 있었는데 저는 평소 관심이 있던 사업기획 부문에서 활동했습니다 . 경영과는 전혀 관련이 없는 전공을 배운 터라 처음에는 사용하는 용어부터 낯설었고 저와는 달리 능숙하게 경영 금융 회계 지식을 뽐내는 다른 학 회원들을 보면서 주눅이 들기도 했습니다 . 하지만 저는 포기하지 않고 처음부터 차근차근 필요한  것들을 배워 나갔습니다 . 수업이 있거나 약속이 있는 시간이 아니면 항상 도서관에 가서 경영 관련 기본서를 읽었고 경영학과 친구들을 찾아다니며 궁금한 것을 묻기도 했습니다 . 그 결과 빠르게 다른 친구들보다 높은 수준의 지식을 쌓을 수 있었고 사업기획 분야의 부문장으로서 발제를 이끌어가기도 했습니다 . 이러한 노력의 결과 모 플랫폼의 사업기획 공모전에서  최우수상을 수상하였습니다 . 저는 항상 더 나은 성과를 내고 남들보다 더 뛰어난 수준이 되기 위해 노력하는 사람입니다 . 국민연금공단 입사 이후에도 최고의 직원 최고의 전문인이 되기 위해 노력할 것입니다 . . 공익에 기여하거나 사회적 가치 창출을 위해 본인이 활동했던 경험 또는 노력에 대하여 작성해주시고 그 과정에서 어려웠던 점 해결방안 및 성과를 구 체적으로 기술해 주시기 바랍니다 . 자 저는 지 자체에서 시행한 공익 목적 공모전에 나가 수상하고 제 아이디어를 실제 공익 제고에 활용한 바 있습니다 . 제가 대학교 때 저의 고향 도시에서는 공익사업 공모전을 개최하였습니다 . 어떤 종류의 것이든 공익을 위해 이 바지할 수 있는 아이디어라면 다 제출이 가능하고 우수하다고 선정된 아이디어는 시가 직접 공익사업 으로 집행을 하겠다는 것이었습니다 . 저는 평소 사업 기획 분야에 관심이 많았고 또 제 역량을 저만을 위해 사용하기보다는 여러 사람을 위해 사용하고 싶었기 때문에 이 공모전은 놓칠 수 없는 좋은 기회였습니다 . 아이디어를 얻기 위해 저는 시의 다양한 사람들을 만나 인터뷰를 진행했습니다 . 시의 행정이나 제도 시설에서 개선해야 할 것은 무엇인지를 다양한 사 람들에게 물었습니다 . 처음에는 낯선 사람들에게 말을 붙이는 것이 매우 어려웠지만 목표만을 생각하며 마음을 단단히 먹고 인터뷰를 진행했습니다 .인터뷰 결과를 토대로 다양한 아이디어를 구상하던 중 아이들의 학교 수업을 도와 주기가 어렵다는 한 귀 화 외국인 학부모의 고충이 눈에 띄었습니다 . 그 학부모의 자녀는 한국에서 초등학교에 다니고 있었는데 학교에서 내 주는 숙제 중 부모가 직접 써 주어야 하는 것들이 있을 때 매우 곤란하다는 것이었습니다 . 한국말은 얼추 할 수 있지만 한 글을 쓰는 것은 아직 서투르기 때문이었습니다 . 본인들은 어릴 때 한국에서 교육을 받은 것이 아니 기 때문에 자녀들이 학교 공부를 물어볼 때 대답하기가 어렵다는 의견도 있었습니다 . 저는 이러한 어려움을 해결하는 방안을 구상하면 이민자와  그 자녀의 한국 사회 적응에 도움이 될 것으로 생각했습니다 . 사업을 구상하기 위하여 먼저 가용 한 자원을 찾았습니다 . 일부 구에서 다문화 가 정 자녀들을 위한 다문화 도서관 사업을 운영하고 있었는데 이 도서관의 사서들은 다문화에도 친숙하면서 학업적 역량도 높은 사람들이므로 이 사업과의 연계를 통해 문제를 해결할 수 있을 것으로 생각했습니다 . 이러한  조사를 바탕으로 저는 다문화 도서관 사업과 연계된 학교 생활 지원 헬프콜 사업을 기획하였습니다 . 어려움을 겪는 학부모들이 전화하면 현재 여력이 있는 사서를 찾아 연결해주는 서비스였습니다 .제가 제안한 서비스는 공모전에서 우수상을 받았고 시에서 현재 시범사업을 진행 중인 것으로 알고 있습니다 . 제 역량을 통해 공익에 이 바지한 뜻 깊은 경험이었습니다 .
2,한국전력공사 합격 자기소개서 샘플 직무 전기 부문 . 어떤 어려운 상황에서도 주어진 업무에 대해 끝까지 수행한 경험에 대해 구체적으로 기술해주시기 바랍니다 . 자 내외 본인이 수행한 업무가 무엇이며 왜 그러한 업무를 맡게 되었습니까 ? 포기하지 않고 업무를 수행한 이유와 그 결과에 대해 기술해주시기 바랍니다 . 자 대학을 졸업하고 경력이 없는 상태에서 측 정기 제조 기업의 전장 설계 분야로 일하게 되었습니다 . 계약직이었기에 시키는 업무만 하면 되었지만 배경 지식이나 업무 관련 경험이 없는 상태여서 현장에서 선임들의 대화를 들으면 이해하지 못하는 부분이 많았습니다 . 그런 상태에서 저는 완제품을 납품 설치하는 업체와 소통하여 작업을 진행하는 업무를 맡았습니다 . 제가 그 업무를 맡은 이유는 다른 업무에  비해 복잡하지 않았기 때문입니다 . 그러나 여러 장비를 납품하는 다양한 업체와 소통하는 것은 생각보다 쉽지 않았고 대화가 잘 통하지 않아서 죄송스러운 마음이 들기도 했습니다 . 그러나 저는 포기하지 않고 질문을 모아서 하루에 두 번씩 선임 직원을 찾아가서 질문했고 세부 사항을 메모하고 업체별 특성을 기억하며 적절하게 대응하며 업무를 진행했습니다 . 그렇 게 첫 프로젝트를 무사히 완수했을 때 높은 성취감을 느낄 수 있었고 이후 완제품 거래처 관리 업무를 혼자서 해낼 수 있게 되었습니다 . . 스터디 그룹 학과 동아리 회사 부서와 같은 조직 내에서 팀원과 공동의 목표를 달성하기 위해 협력했던 경험에 대해 기술해주시기 바랍니다 . 자 내외 본인이 수행한 업무가 무엇이며 왜 그러한 업무를 맡게 되었습니까 ? 사 람들과 함께 일을 처리해 나가면서 그 사람들과의 긍정적 관계 구축을 위해 추가적으로 기울인 노력과 그 결과에 대해 기술해주시기 바랍니다 . 자 졸업 작품을 제작하며 팀원들과 협업하는 과정에서 공동의 목표를 달성하기 위해 주도적으로 노력했습니다 . 저는 팀장으로서 팀원들의 아이디어를 취합하고 구체화할 수 있도록 방안을 제시하는 역할을 했습니다 . 제가 팀장 을 맡은 이유는 마지막 학기에서 회로 설계를 기획하고 설계를 수행하면서 높은 점수를 받았기 때문에 팀원들이 저를 팀장으로 믿어주었기 때문입니다 . 저희 팀은 회로 설계나 코딩 등 기 본기가 충분했으나 아이디어를 취합하는 과정에서 가장 오랜 시간을 소요했습니다 . 서로 자신의 아이디어를 주장하기만 할 때 저는 각 의 견의 장단점 구체화 방안을 제시하여 의사결 정에 도움을 주었습니다 . 또한 감정적인 다툼을 막기 위해 모든 의사 결정 단계를 객관적으로 정리하고 온라인으로 공유하며 팀원들이 이성적으로 판단할 수 있게 했습니다 . 그 결과 저희 팀은 온도 센서와 를 이용한 두 가지 아이디어를 결합하여 창의적인 결과 물을 제작할 수 있었습니다 . . 약속과 원칙을 지켜 신뢰를 형성하거나 지킨 경험에 대해 구체적으로 기 술 해주시기 바랍니다 . 자 내외 당시 상황에 대해 구체적으로 기술해주시기 바랍니다 . 약속과 원칙을 지키기 위해 어떤 노력을 하였으며 그 이유는 무엇입니까 ? 그 일을 계기로 본인에게 생긴 변화 또는 느낀 점은 무엇입니까 ? 자 대학생 홍보단으로 활동하며 박람회 도우미로 행사에 참여한 적이 있습니다 . 저를 비롯한 여 명의 대학생 홍보단은 각자 맡은 업 무가 달랐는데 저는 홍보 전단을 나누어주는 역할을 맡았습니다 . 박람회 방문객들은 수많은 기 업체의 홍보 전단을 받아야 했기에 피로도가 높았고 홍보 전단을 받고 나서 그 자리에서 버리거나 아예 받지 않으려고 하는 분들이 많았습니다 . 저와 같은 역할을 맡은 다른 학생들은 방문객들의 냉담한 반응에 어려움을 느끼고 점차 소극적이게 되었습니다 . 일부는 홍보  전단을 부스에 가져다 놓고 임의 로 다른 업무를 하거나 쉬는 등 불성실한 태도를 보이기도 했습니다 . 그러나 저는 맡은 업무가 약속이라고 생각하고 끝까지 책임감 있게 수행했으며 정해진 시간 동안 새 전단을 배포하고 버려진 전단을 정리하는 등 솔선수범하여 업무를 완수했습니다 . 이 일을 겪은 후 냉담한 고객을 대하며 상처받지 않는 용기를 갖게 되었고 어려운  일이라도 끝까지 수행하는 책임감의 중요성을 깨닫게 되었습니다 . . 직무 에세이 한 전 에 지원한 동기 관심을 가지게 된 계기 시기 등 와 본인이 가지고 있는 직무 관련 역량 또는 경험을 상세하게 기술해주시기 바랍니다 . 자 한 전 는 국내외 발전 설비와 신재생 송변전 및 산업 설비 분야에서 뛰어난 성과를 보이고 있는 기업입니다 . 특히 원전 해체 사업을  위한 기술 확보에 앞장서고 있으며 신 재생에너지 사업에도 적극 참여하는 기업의 행보에서 미래 지향적 안전 지향적인 모습을 발견했습니다 . 또한 졸업생 선배 중 한 전 에서 현역으로 근무하는 분에게 기업 문화와 실무에 관해 구체적인 이야기를 듣고 한 전 에 지원하게 되었습니다 . 직무 관련 경험으로는 졸업 후 측정기 업체에서 장비 유지 보수와 개선 프로젝트를 수 행한 것을 이야기하고 싶습니다 . 저는 프로젝트 수행 과정에서 고객이 원하는 것을 정확하게 파악하려 노력했고 생산 설비 설계 및 개조를 통해 생산성을 향상하고 안전 수준을 높였습니다 . 직무를 수행하면서 알게 된 것은 저의 꼼꼼한 성격과 안전을 추구하는 기질이 직무에 적합하다는 것이었습니다 . 대학에서 실습을 수행하면서도 다른 학우들이 놓치는 이론적인  부분이나 안전 문제를 발견하여 사고를 방지한 경험이 많았고 실무에 투입되면서 이러한 성향은 더욱 가치를 발휘했습니다 . 번의 사항을 바탕으로 한 전 에서 수행하고 싶은 직무에 대하여 기술해주시기 바랍니다 . 자 한 전 에 입사하게 된다면 발전 사업 분야에서 일하고 싶습니다 . 구체적으로는 해외 발전 사업에 도전하여 글로벌 프로젝트를 수행하고 해외 국가에 국 내 발전 기술의 우수성을 알리고 싶습니다 . 저는 해외 발전 사업 중에서도 사업 관리 및 안전 관리 분야에서 일하고 싶습니다 .군대에서 전기 공사에 투입되어 작업하던 중 전류가 흐르는 상태에서 전선을 자르던 선임이 감전되는 것을 목격하고 차단기를 내려서 큰 사고를 막았습니다 . 작은 규모의 공사에서도 방심하면 사고가 일어나는 것을 체감하게 되었고 안전  관리 전문가가 되어야겠다고 생각하게 되었습니다 . 한 전 의 여러 사업 중에서도 가장 규모가 크고 예상치 못하는 사고 가능성이 높은 분야가 바로 해외 발전 분야 일 것으로 생각합니다 . 해외 사업에는 많은 어려움이 있겠지만 끝까지 책임지고 자 하는 책임감을 무기로 끈기 있게 노력하고 안전을 지키는 직원이 되고 싶습니다 . . 한 전 의 중장기 전략경영계획 비전  을 참고하여 본인의 향후 역량 개발 계획을 상세하게 기술해주시기 바랍니다 . 자 내외 한전 의 비전은 글로벌 발전 플랜트 솔루션 제공자 입니다 . 저는 이 비전에서 글로벌 발전 플랜트 설비 라는 키워드를 읽어냈고 이에 대해 고민한 결과 한 전 의 중장기 목표에 동참하기 위해 크게 세 가지로 역량 개발 계획을 구체화해야겠다고 결심했습니다 . 첫 번째 전기 분야  전문가로서 직무 역량을 쌓는 것입니다 . 입사 후 년까지는 업무를 익히면서 전기 분야의 전문성을 심화하겠습니다 . 또한 현재 준비 중인 전기공사 기사를 올해 안에 취득하겠다는 목표를 세우고 공부하겠습니다 . 자격증 취득만이 아니라 꾸준히 직무 관련 교육을 이수하여 이론과 실전을 모두 잡는 것이 목표입니다 . 입사 후 어떤 부서에서 무슨 업무를 맡게 될지  아직 알 수 없지만 졸업 후 짧게나마 실무 경험이 있기에 발전 분야의 이론적 지식과 배경 능력을 바탕으로 주어진 업무를 원활하게 수행할 수 있을 것입니다 . 두 번째 안전 분야의 전문가로서 역량을 계발하여 성장하는 것입니다 . 입사 후 개인적인 중장기 계획으로 전기안전관리자에 도전하는 것이 목표입니다 . 저는 발전 설비 업무를 수행하면서 이론적 실무 기 능적으로 뛰어난 직원이 되는 것도 중요하지만 플랜트와 같은 대규모 설비에서는 안전 분야의 전문가가 되는 것도 의미가 있다고 생각하기 때문입니다 . 전기안전관리자로서 활동하기 위해 산업안전기사를 취득하고 더 큰 규모의 실무 영역에서 활동하고 싶습니다 .세 번째 어학 능력을 꾸준히 향상하여 글로벌 인재로 성장하는 것입니다 . 한 전 는 해외시장 진출 이후 약  여 개국에서 한국 기술의 위상을 높여왔습니다 . 저는 해외 발전설비 운전 및 정비 사업에 참여할 수 있도록 영어와 더불어 다른 한 가지의 외국어 회화 능력을 기르겠습니다 . 아직 유창한 수준은 아니지만 베트남어 학습을 해 본 경험을 바탕으로 다른 필요한 언어가 있다면 빠르게 학습하여 업무에 활용할 수 있습니다 . 이러한 능력과 의지를 바탕으로 글로벌  인재가 될 수 있도록 준비하겠습니다 .
